Date,Author,Location,Rating,Heading,Body
2025-02-28,"Durres Alb G,M Philadelphia",IT,5,Super consiglio ottima agenzia online ,Super consiglio! Viaggiato con loro per Stati Uniti e Repubblica Domenicana viaggio di nozze meraviglioso e risparmiato parecchio. Molto bravi 
2025-02-26,Renata,IT,5,Ho acquisto 5 biglietti da Milano a…,Ho acquisto 5 biglietti da Milano a Lima per viaggiare insieme alla mia famiglia e tutto è andato benissimo! Ho ricevuto i biglietti per email e siamo rientrati stamattina. Ottima agenzia di viaggi e super onesti. Consiglio ! 
2025-02-24,Carmela,IT,5,Molto affidabile mi sono sempre trovata…,Sono Molto affidabili mi sono sempre trovata bene! Ho acquistato più volte biglietteria aerea per Argentina con loro senza problemi. Consiglio 
2025-02-26,TERESA,IT,5,Hanno i prezzi migliori e sono…,Hanno i prezzi migliori e sono efficienti. Consiglio. Ho comprato un biglietto per la badante dio mio papà per Ecuador Quito e mi sono trovata benissimo. Viaggiato senza problemi e ho risparmiato parecchio. Molto bravi e affidabili. Agenzia online seria 
2025-03-05,Mattia,IT,5,Affidabili! Potete Prenotare tranquilli! Agenzia online sicura ,Ho acquistato dei biglietti aerei per cuba partendo da Milano con relativo soggiorno in hotel. Ho ricevuto la conferma per email e tutto si è svolto correttamente. Agenzia di viaggi affidabile ho prenotato tutto tramite whats'app senza nessun problema. Pagato tutto tramite bonifico. Affidabili e consiglio! Potete prenotare Tranquilli! 
2025-03-06,Sofia Pellegrini,IT,5,Ho acquistato una pacchetto vacanze per…,"Ho acquistato una pacchetto vacanze per il Peru per la mia famiglia, con volo da Milano a Lima e hotel. tutto perfetto! Grazie mille siete straordinari come sempre! La migliore agenzia online super affidabile! "
2025-02-21,Enrico,IT,5,Affidabili! Agenzia online ottima,Affidabili! Sono molto soddisfatto. Agenzia seria e onesta.  Ho acquistato online tramite whatsapp un biglietto aereo per Sydney e ho risparmiato parecchio con loro. Tutto andato bene senza nessun problema. Consiglio alla prossima! 
2025-04-06,ARGENZIANO ANTONIO,IT,5,Affidabili! Ottima agenzia viaggi online ,Affidabili! Ho organizzato il mio viaggio a Repubblica Dominicana a Bayahibe e tutto perfetto! Sono i migliori come prezzo e servizio. Documenti di viaggio arrivati e nessun problema. 
2025-03-17,PAULO CESAR MOREIRA,IT,5,semplicemente perfetto,"Il mio viaggio in Brasile con Latinos Travel è stato semplicemente perfetto! Fin dal primo contatto, ho ricevuto un servizio impeccabile, con grande gentilezza e professionalità. L’offerta che mi hanno proposto era davvero ottima, con un rapporto qualità-prezzo eccezionale. Tutto è stato organizzato nei minimi dettagli, permettendomi di vivere un’esperienza senza pensieri. Consiglio vivamente Latinos Travel a chiunque voglia viaggiare con serenità e sicurezza. Top!

"
2025-02-28,Ilaria,IT,4,Ho comprato un pacchetto vacanza per…,Ho comprato un pacchetto vacanza per Marsa Alam Egitto e mi sono trovata benissimo. Molto professionali e attenti alle mie esigenze. Grazie alle loro tariffe allotment ho risparmiato e mi sono trovata benissimo. Consiglio potete prenotare tranquillamente. Biglietti aerei e voucher arrivati dopo il pagamento. Affidabili 
