Date,Author,Location,Rating,Heading,Body
2019-02-18,Philip Radomski,US,5,Great product,Great product.  No issues ordering or installing.
2024-10-17,Andrea Schreiber,US,5,The pieces are really nice and…,The pieces are really nice and professional…my handyman was really impressed with the quality too as he was putting them up.
2018-08-01,Guy Miner,US,5,Easy to order and install Great company,Easy to order and install. The service was excellent the quality of the product is excellent.
2021-06-02,Kenneth Koons,US,5,GReat product and easy to work with.,GReat product and easy to work with.
2019-02-14,Laurie Mitchell,US,5,Absolutely fantastic company and even…,Absolutely fantastic company and even more fantastic product! I spoke with Bob on the phone several times and he was incredibly helpful and very patient. Would highly recommend this company and hope to use them again! Definitely 10 stars in my book.
2020-12-11,Dan Gentile,US,5,A DIY Dream,"If you want to beautify your home with wainscoting at a very reasonable price,  you MUST use this company.  They make the process very easy and make sure things are accurate to the inch.  Debbie ROCKs with her expertise and her kindness.  She will take as much time as needed to assist and give you invaluable advice.  No need for a contractor to do this work to add tremendous value to your home.   Just measure where you  want it to go, input the info into their online planning app, wait a few days for delivery (which in my case was across the country,) nail it, paint it and watch your home be transformed beyond what you ever imagined.  I’d give them a 10 if I could."
2017-08-30,Joe Fischetti,US,5,As a renovation Contractor,"As a renovation Contractor, Wainscoting America, has been a fantastic supplier. Great product and the customer service is outstanding. 
Respectfully Submitted ,"
2017-06-22,Michael Mooney,US,5,Great product Excellent Service they …,"Great product Excellent Service they went above
and beyond with customer satisfaction. I loved to
see the Made in USA label on shipping package.
Wish I new about this company when I lived in 
my first house. I planning my next project for later
this year. Thanks Again"
2019-06-27,Seth,US,5,Great product,"Great product, speedy delivery and exceptional customer service.  Have purchased numerous times from this company. Always 100% satisfied."
2023-04-19,Gary Sacco,US,5,Service is responsive and helpful,"The online tools are great, but my job was complex (kitchen island wrap) with lots of corners.  The team took the time to discuss my project live on the phone and was very responsive provided detailed layouts.  In the end, I have a beautiful new island that was super easy to install."
2017-02-21,Brian M.,US,5,Great company!,The service was great with some customization at no extra charge. Great product and great service.
2017-01-10,Kevin,US,5,Would do it again,Perfect experience.  I can't say enough.  I think it is a great idea and as I put it in I can't believe I thought about building it the hard way.  If you are painting the wainscoting then this is the way to go.
2020-08-09,Sharon Verhoff,US,5,The product is beautiful and their…,"The product is beautiful and their customer service is second to none. When looking for wainscoting, look no further than Wainscoting America."
2021-02-23,Dave ,US,5,Great product and great people to deal…,Great product and great people to deal with. The finished product is beautiful.
2022-01-14,Rick Leach,US,5,Excellent customer service,Excellent customer service. All panels arrived on time and all measurements were accurate. I'll use this company the next time my customers need wainscoting.
2017-07-28,Brad O.,US,5,great company and product,"great company and product.  Go out of their way to make sure the order is correct. 
I had wainscoting made for a stairway in an old house, things aren't exactly square or up to date.
Owner contacted me to double check on the measurements, take me thru the process and ensure we got it correct.

Product is great and packaging is above and beyond to make sure it arrives in perfect condition."
2018-03-02,Susie Henry,US,5,What an outstanding job they did,"What an outstanding job they did! I literally bought the cheapest home depot cabinets to make an island. They made the wainscot panels and when the panels arrived, all pieces fit like a glove to include all the mitered cuts!  They made my cheap cabinets look like top of the line with minimal cost. Even my contractor of over 30 years was impressed and will be using them for future projects. Thank you Scott and Deb! And did I mention the excellent customer service? They always answered my questions and returned my phone calls expeditiously."
2021-04-21,customer,US,5,Excellence,"I have ordered raised panel wainscot panels from Wainscoting America for two room remodels. The ordering process is easy and straightforward, the product is quality, the measurement sent are followed exactly, the turn-around and shipping is fast, and the product arrives well packed and in excellent condition. I have only had one damaged item( electric box extenders) and Wainscoting America reimbursed me immediately for the shipping mishandling. I recommend their product and workmanship without hesitation!"
2020-08-12,David Strock,US,5,Life saver,"I was having an issue matching recessed shadow boxes that were embossed into the drywall from 20 years ago. The dimensions were not the standard of today and the ability to design the panel and sizing was key to making this work.
I recieved the panel i needed in great condition. Only took a few days to get here from time of order. Once installed the customer was thrilled with the finished product. The detail of the box edge wasnt exact but again i was trying to match something from 20 years ago. 
I will definitely be using this company again for future endeavors."
2021-10-06,Randy Catalano,US,4,Product is as advertised and sized exactly as specified,"The product was shipped on a pallet and arrived in perfect condition.  The packaging was very well done although some of the finished panels had spray foam on the finished side.  In the how-to-video it stated that extra pieces of raised panel would be included so that the installer could frame out an electrical box.  It was not included. I've had to plane down some scrap wood to match the 0.320 thickness of the stiles. The product backboard is a bit soft and drilling creates a ragged hole on the back side.

Otherwise the product is as advertised and sized exactly as it was planned."
2020-08-24,Scott K,US,5,The material and dimensions are always…,The material and dimensions are always perfect and arrives very quickly. The owners are more than happy to assist you should there be questions. SK
2021-04-11,Michael Van Schooneveld,US,4,Panels look great,"Panels look great. Heavy, but easy to paint. Had an issue with the sizing initially, but customer service immediately corrected and got me replacement panels asap."
2020-05-19,Paul Roberts,US,5,packaged well,"packaged well
delivered on time
bob muckley's attention to detail lead to a good instal"
2016-04-20,Alfrred Evano,US,5,on time on budget on the wall,I recieved my order when they said it would arrive. The packaging was excellent nothing missing or damaged.The sizing was just as I ordered.It was a pleasure doing business with Wainscoting america.
2020-12-28,Trina ,US,5,Great service and great product,Great service and great product. Improved the looks of my house tremendously.
2019-11-18,Robert Fenstermacher,US,5,"Excellent product, great design tool.","Excellent product.    Received the wainscoting on Friday afternoon, it is well made and exactly as designed.   I installed in on Saturday and it looks awesome."
2016-06-19,Tony Marucci,US,5,"Great service, great product","Scott was the best, after I painstakingly measured and calculated to account for the 5/8"" panel thickness, then wrested with the design of the specialty panel going behind the toilet and sink in our half-bath, I sent the measurements and some pics to Scott, and the next day he emailed me  detailed drawings with panel installation order, different options for the specialty panel, he  incorporatedthe existing HVAC register and electrical outlet, etc. I tortured him with almost daily emails, questions, etc. and every inquiry received a prompt reply or call that day if not within 24 hours. And all this was for an order that with shipping that barely totaled $850. My order arrived to NJ in about 2-3 days after placing order, panels are extremely high quality, 4.5"" poplar base molding and cap rail are impeccable furniture quality knot-free wood that is almost a crime for me to be painting, would highly  recommend and will be ordering from them again when I get to my dining room project.  Thanks again Scott, you've got a lifetime customer and referral source for anyone interested in a high quality and reasonably priced product!"
2021-08-06,Frank,US,5,Fits were perfect easy too install and…,"Fits were perfect easy too install and the help with ordering and balancing panel sizes was good. 
Also delivery was as stated."
2018-02-24,LEO HARRINGTON,US,5,My first time experience was great,"My first time experience was great! Good qualty work- precise measurement, on time, no surprises. I would use thrm again."
2018-04-16,Chuck Ketchum,US,5,Great Products,"Everything I received was exactly as quoted and on the drawing accompanied with the quote.
The product came undamaged due in part by the excellent packaging.
I have had many compliments from friends and family who have to my house since my installation of the product.
I would not hesitate to order or  recommend wainscoting products to anyone for future projects."
2017-04-19,Denise,US,5,Excellent customer service and …,Excellent customer service and assistance with the order. Everything arrived on time and in great condition. A quality product from a quality company.
2024-10-08,Mary Prody,US,5,Working with Deb on measurements and…,"Working with Deb on measurements and design, she is amazing and always accessible! The product is great quality, and the finished wainscoting is gorgeous!
Mary Prody"
2020-12-28,Mark Parris,US,5,An excellent product snd experience.,"An excellent product.  Presumes a degree of carpentry and finish carpentry skill.  Design/order process is mostly intuitive and they answer the support line on the first ring if you run into a problem.  Orders come well packaged and mine was in fact shipped within the 5 business days they promise.  No damage in transit.  Wainscotting cuts were accurate to within 1/16th of an inch and slope for staircase pieces was spot on.  Bottom line: if you are confident of your ability to measure accurately and do basic installation this is a great way to save thousands of dollars on a classy, custom look."
2019-08-16,Dominic,US,5,Outstanding customer service,Outstanding customer service!  Produced my wainscoting on a rush project and delivered in 6 calendar days!  Product is exceptional!  Have been a customer in the past and will certainly be a customer again!  Can not recommend more highly!
2019-12-09,Patrice Wright,US,5,Excellent product and fast delivery,The panel arrived intact and exactly as ordered.  We couldn't be happier.
2018-10-08,Paul B,US,4,Nice panels,"Nice panels, quickly delivered. The only negative is that the MDF material takes more work to paint."
2022-10-12,Ann Esbeck,US,5,great quality samples,The panel samples are great quality and what we were looking for to help us make our decision on what type of wainscoting we are going to installz
2017-12-14,Jeff S.,US,5,You won't be disappointed,I've ordered wainscoting twice and both times it was fantastic.  The materials are packed very well and the trim pieces (caps) are perfectly straight and flawless.  Would highly recommend.
2017-04-24,James Monyhan,US,4,I received the product on the date …,I received the product on the date promised. The quality of the wainscoting is excellent. This isn't the cheap flimsy poor quality wainscoting that I found in my nearby home improvement stores. The staff was very knowledgeable and extremely helpful during the design/ordering process.  I am totally satisfied.
2018-09-05,CustomerJohn B.,US,5,Spot on to Wainscoting America,"We have nothing but highest accolades to Wainscoting America. The team did a wonderful job on our staircase and fireplace. Its was a true pleasure working with Bob Muckle and his team. We're just so impressed with the quality of workmanship. We never thought that we would get a product so SPOT ON with such accuracy since all communication was done through emails for the  measurements and pictures. 
We highly recommend Wainscoting America and Bob Muckle to handle all of your projects. You will be amazed by this company's performance."
2016-12-22,Adnan S.,US,5,Great product as advertised,Still working on the wainscoting but so far it's looking beautifully
2018-09-28,Virginia Rush,US,5,I was very pleased with the person from…,"I was very pleased with the person from the design team who listened and advised me on our project. The only disappointment is that it took several days longer than expected to be delivered but there was a mixup with Federal Express which added to the delay as well. 
Important tip: The primer really sinks into the MDF board so make sure you don’t skimp on the primer. Looks fantastic now that it’s all hung and painted!!!! Highly recommend using."
2021-03-02,Craig Dulak,US,5,Great fast service and delivery.,Great fast service and delivery.
2018-05-11,PAMELA,US,5,This is terrific,"This is terrific, simple, measure install minimum seams, great looking"
2023-04-05,Mark Ward,US,5,Second room,Deb was wonderful to deal with and I love there product. This is the second room I did and it looks great.
2018-12-27,"John Kreamer Capentry and Remodeling, Inc.",US,5,Awesome Company!,"As a professional remodeler, I see the best, but mostly worst of what's out there.  It is refreshing to do business with a company that takes pride in what they make, stands behind it, and has your back when you need them.  Wainscoting America produces an excellent product at a great price, packages it to withstand the rigors of shipping, and gets it there in a timely matter.  The staff is helpful, friendly and accommodating.  I am the first one to complain about poor service and inferior products, so let me tell you this company is a CLASS ACT!"
2020-08-25,Kathleen Schluensen,US,5,Sample product,Sample product was received quickly and is of high quality. Very helpful in making my decision on my project..
2019-08-29,Beth Clifford,US,5,We love the product,"We love the product!  We had excellent support along the way that was timely and responsive!

Thank you!"
2021-10-24,Brian N,US,5,Raised panels for polygon shaped bathtub.,"We ordered raised panels to update our polygon shaped bathtub surround.  This was a difficult shape to fit but on receipt of the panels we were able to install with minimal tweaking.  The end result is exactly as we hoped.  The panels were of excellent design and quality, the Sales department was very helpful and easy to deal with and the panels were expedited to us in a timely fashion.    Would highly recommend."
2020-05-05,Prudence Ryan,US,5,These folks are the best,"These folks are the best! I needed a small panel fabricated a bit differently than the standard. They were very accommodating and quick. Kept the job on schedule, even in these difficult times. Great communication, highly recommended."
2018-11-29,John Ely,US,5,Great people to deal with and…,Great people to deal with and wonderfull product
2017-10-07,James Dick,US,5,Great Service.,"Very easy to deal with. Talked with Rep. on the phone, walked me through my ordering problem, material was here within a week. Good looking product easy to install. Everything fit perfectly."
2018-08-08,Mike A.,US,5,"Design tool easy to use, very good quality product.","Website and design tool for custom wainscot was overly easy to use.  Very good quality product, easy to install.  Very happy with our purchase."
2024-08-07,customer Nick V,US,5,Very professional great product.,Very professional great product.
2021-07-06,Brian Maynard,US,5,Everything arrived in perfect condition…,"Everything arrived in perfect condition and was made as ordered. I wanted a formal dinning room and this product gave me the exact custom look i wanted 
Thank you!"
2021-03-03,Mr Mike Cox,US,4,Good service and prompt delivery,Good service and prompt delivery. Unpacking a and cleaning shipping foam off of the panels was a chore.
2019-12-19,Paul Archer,US,5,Excellent company was very satisfied…hallway wainscoting,Excellent company was very satisfied with there product I have not installed it due to the Christmas season Will send photo of finished next year Very Happy and I would highly recommend them paul archer
2019-03-13,Johnise and Steve Nuttycombe,US,5,WOW We were VERY pleased with the quality!,"WOW!  We were truly satisfied with our recent purchase.  After receiving several quotes from local carpenters, we were nervous to find the product affordable and first quality.

We highly recommend this company and will use them again in the future!"
2017-05-31,Timothy Jeric,US,5,I have had an excellent experience with …,"I have had an excellent experience with Wainscoting America!  I ordered three custom Beaded Raised panels for our 1/2 bath remodel project and the measurements are spot on, panels were all in perfect shape and Deb in sales/accounting even called when I originally ordered the first test panel as well as when I ordered the remaining two to make sure everything was spec'd properly and to verify measurements and other particulars.  You get what you pay for as they say and in this case I couldn't be more pleased."
2021-04-18,customer,US,5,Very fast delivery after placing order,Very fast delivery after placing order! Looks beautiful!
2017-02-13,customer,US,5,Finished project,"The panels were received in perfect condition (seems like they spent as much money packing/crating as I did purchasing).
THE WIFE IS ECSTATIC...I'm happy too!
Great work...back for more soon!"
2022-12-27,The Jeep,US,5,Great product and great service.,Great product and great service.
2021-06-08,Customer,US,5,Beautiful job,"Beautiful job. Better than what i had planned. They listened, made suggestions, and turned out a quality project."
2018-05-23,Erica Howes,US,5,beautiful product!,The on-line information was very informative and easy to measure and order myself!  I am very satisfied with how my dining room came out with the beautiful custom-made wainscoting!
2017-01-28,Same H.,US,3,too expensive,"Expensive,  but very high quality and in line with other products I have evaluated."
2019-05-14,Scott Koelliker,US,5,Great product and service!,"I cannot thank the staff at Wainscoting America for their diligence in making sure I had accounted for all of the correct measurements, chose the right product and even installed it in the correct order . The result is absolutely amazing and beautiful in design and appearance. Everyone from professional carpenters to family and friends comment on what an amazing result. I deeply appreciate all that they did to make this project successful!"
2018-09-26,Elizabeth Johnson,US,5,What a wonderful find,What a wonderful find.  We love the choices and assistance that Deb afforded us.  Installation was super easy and we are in the final phase of painting it all.
2016-07-16,Ram R.,US,5,Good product,Good quality product. On time delivery.
2021-04-07,Kevin D,US,5,Very helpful over the phone for my PVC…,Very helpful over the phone for my PVC wainscoting order. Fast turnaround and shipped quick.
2018-11-29,Thomas Browne,US,5,great service,great service
2024-03-02,Ron Beattie,US,5,"Working with these guys was great, accuracy was incredible.","Working with these guys was great.  Deb helped us tremendously from the start as our installation was a bit complex but she was patient and knowledgeable and our order was placed in a very timely manner.

The quality of the panels are incredible and the accuracy of the dimensions were spot on.  The only problem that we had were biscuit routing on two panels didn't align properly but we were able to work around that."
2021-03-23,Steven G,US,5,Excellent Service and Product,Fantastic service and excellent product. The folks at Wainscoting America are great to work with and are eager to help their customers get the quality product they desire. Highly recommended !
2021-03-14,Greg Barnes,US,5,Excellent quality and perfect shipping,"Excellent quality and perfect shipping. I do a lot of renovations and have used wainscoting many times, nothing came close to the quality of these panels. I will definitely be purchasing again."
2017-10-09,Del ,US,5,A good solid company,A good solid company - nice to have them around. Del
2021-01-29,Matthew Robinson,US,5,Exactly what I wanted,The online ordering template made working out the panels simple.  Their designer called me after I placed the order to make some useful suggested changes which were implemented. The panels arrived as promised a week or so later.  They were well packed and labelled which aided installation.  An excellent product for anyone contemplating wainscoting.
2017-09-07,Dean Kinkoph,US,5,Excellent work,Excellent work. Even when I messed up they made it right. Excellent customer service.
2017-08-17,Walter Roller,US,5,Quick delivery Perfect Fit great people,Quick delivery Perfect Fit great people
2022-02-07,Marcelino Seymour,US,5,Great customer experience!,The samples arrived in a reasonable amount of time.  They were very helpful in making a decision on which design I am going to order.  I think Wainscoting America will be great to work with.
2018-02-10,jrgenoa,US,5,This was a truly exceptional …,"This was a truly exceptional transaction.    The order entry website was user friendly and allowed for a high degree of customization.    Communication,  from order entry to shipping notification, was timely and accurate.   Rapid delivery, robust packaging, beautiful product  and a fair price, I highly recommend."
2019-07-23,Vo Huynh,US,5,Best service fast shipping always…,Best service fast shipping always recommended.
2018-06-14,Miguel DeLeon,US,5,Wainscoting America Customer Service,"I recently purchased wainscoting from Waincoting America. The staff (Debbie and Scott) was invaluable. I sent drawings and the team took several hours for several days discussing and suggesting recommendations. When I received the product it was as discussed. Installation went as instructed. I am very happy with the install and the look. Additionally, the team is available during the install guiding you through. Wainscoting on walls makes such a difference. It provides elegance and class to any room. I plan to do it in several rooms."
2018-11-12,Kevin Hennessey,US,5,Excellent overall experience,Excellent overall experience.  Deb was very patient and helpful.  Installation was simple.  Product looks great!
2022-02-23,Jared Johnson,US,5,Everything went better than expected,Everything went better than expected. Fast   Fast.  Fast looks great and easy to install. Very happy with the whole transaction. Will do business again. Thank you
2018-07-25,Gregg Hopson,US,5,Quality is impeccable,"Quality is impeccable, communication was great, Bob Muckle helped me through every step of the process seamlessly and the attention to detail is uncanny. I would recommend this company to anyone looking to utilize Wainscoting in their home."
2024-12-17,Lynn Durand,US,5,Wainscoting America was great to work…,"Wainscoting America was great to work with.  They took an extensive amount of time working out the exact details of each of 21 panels of wainscoting, helped me with design and were very friendly and helpful tthrough he entire process.  And, once installed the product looks fabulous.  I Highly recommend  Wainscoting America. "
2021-05-20,Eileen McAlary,US,5,I requested a sample and it came…,I requested a sample and it came quickly with no problems. My customer loves the sample and I will be ordering your produce. Thank you Abby Home Improvement.
2021-05-25,customer,US,5,Very happy with process and result!,The team (Deb) who worked with us to plan was incredibly helpful and knowledgeable. The product was well packaged and arrived in a timely fashion. Our carpenter who installed also commented on the quality and ease to install given how detailed the cuts and plan were. I would absolutely use the company again and recommend to anyone interested in wainscot.
2021-01-14,Bill Futral,US,5,Minor issues - love the panels,"First, I love the panels - in the middle of installing them now. There were two issues, neither stopped me from going forward. First, they sent the wrong top rail. I had ordered the smaller one which is more appropriate for my office, but received the larger one - not a real problem. At least one of the panels is a slightly different height (1/8 inch). Again, not a big problem. All lengths are as ordered. 
Panels came two in box, so each box is a heavy. Difficult for one person, you really need two people. Panels are delivered by a semi-trailer, so plan of unloading on the street.
I wish they would have sent a couple of scrap HDF pieces for positioning purposes. The HDF cuts really well - no problem trimming the panels. The HDF takes the primer very well - haven't painted yet.
** Follow-up: Within hours of posting my review I received a call from WA offering to replace the parts. Nice to have great customer service - so I am changing my rating to 5 stars."
2023-03-17,Mark Lamb,US,5,Back for more,Second time I placed an order with them. Everyone you talk with is super helpful. Product arrives promptly and is packed super well. Looks great after installation.
