Date,Author,Location,Rating,Heading,Body
2022-09-17,Howard Walvick,US,5,Every Comment about Deb is True,"As I read the web comments, I was suspicious as they were too good, but I am very glad to state that happily it all was true.  I was searching for months for wainscoting without any success.  I asked all over and no one was able to help me.  Luckily I found on Google ""Wainscoting America"".  After my initial call with Deb, I knew this is exactly what I wanted.  Because this is done over many phone calls, emails and photos but not in person, Deb was extremely exact to get all the correct dimensions as if something is wrong, it has to be returned.  She calculated exactly how much I needed and how to make it so simple for my contractor to install.  I was unaware that some of the corners to my walls were not joined at 90 degree angles - Duh.  She wanted to know everything.  I want to thank her as she skillfully lead the whole project and even provided links to videos.  My wainscoted walls are so beautifully done that I cannot block them with my furniture.  Thank you DEB."
2019-01-15,Joe Wicker,US,5,I placed an order they worked with me…,I placed an order they worked with me the product came out look great and it was easy to install there was a little problem with a panel but they made a new one and shipped it no charge we are very please with the product and the company
2019-08-06,Steve DeMatties,US,5,Great to do business with Would…,Great to do business with Would definitely recommend them
2021-03-31,Larry White,US,5,Couldn't be happier,"This was the first time for me to use any product like this.   Im a little more than a DIYer, but Wainscot America answered my calls and questions and the web sight was easy to make the order.  I ordered around 100 lineal feet of wainscot and cap and crossed my fingers! Its all installed with no issues."
2016-10-27,Mauricio A.,US,5,Fantastic Job,"They are really professional and i did my whole house for a fraction of the cost if i hire a company, super easy to install. Top quality material! Fantastic customer service, they help you to measure, everything you need..."
2020-03-05,Merrill Pittman,US,5,This is the 2nd time I have purchased…,"This is the 2nd time I have purchased their products, the first being in 2011.  I had a builder help me this time around and he said it best.  ""This is the best wainscoting I have ever seen.""  

You need to be careful because most of this stuff you buy from big box stores is very cheaply;made.  After a few years it can warp and the joints don't fit. 

Great product and excellent service."
2020-11-17,Lisa Skocypec,US,4,I loved the Wainscoting website,"I loved the Wainscoting website.  If it actually interfaced with the production tools it would be GREAT!!!  The website was easy to use, the product is of high quality and the support personnel where very responsive.  We had one glitch though.  Someone typed our dimensions into the production tool incorrectly so our order did not get made correctly.  Wainscoting America made it right.  Quickly reproduced the correct dimensions and shipped them.  They look great!!"
2021-05-07,Pete Willson,US,5,THe product arrived with one panel…,THe product arrived with one panel broken and they promptly remade and shipped it out and we received within 5 days. The product was very well made and I would use them again.
2019-10-17,John Reynolds,US,5,Everything was what I ordered it was on…,Everything was what I ordered it was on time everything fit perfect.
2019-05-20,Margaret Valerius,US,5,They have done everything they were…,They have done everything they were asked to do in a timely manner.  I made a mistake prior to completion and they quickly fixed my error.  One thing which would be nice is if they had an option to have the panels primed but otherwise This is a five star experience
2020-09-24,Jeffry Turner,US,5,Perfect,Perfect. Great upgrade for our island.
2017-11-03,Francis,US,5,Bought the cap trim for my 5/8 …,"Bought the cap trim for my 5/8 wainscoting and it looks fantastic. 
Thank you."
2024-01-16,Loic,US,5,"Zero experience with diy, yet great results!!","I will start by the fact that I have 0 experience in doing this kind of things. But I was put off by quotes from professional, so I decided to do the trimming/ wainscoting installation myself. Each step has been incredibly easy: designing, ordering, installing. Materials are good quality and results are outstanding. No one is believing I did it myself. I highly recommend"
2019-09-14,Fernando B.,US,5,Super,Excellent service and product !!
2024-02-21,Dennis P,US,5,A First Class Experience for the Second Time,"This was our second experience with Wainscoting America, and once again it did not disappoint. From the completion of our design, through order placement, and speed of delivery, their support and assistance was first class."
2018-09-10,Timothy Kane,US,5,wounderful walls,great company to deal with. Outstand worker. Great product.  Love the walls.
2016-11-24,Dave D.,US,5,"Great Product, went above and beyond","I ordered these panels hoping to get them in before Thanksgiving. They showed up very quickly and I was already to install on the Saturday before T-giving. Unfortunately an error was made by the company and one of the panels was made incorrectly. Being a Saturday no one was there and I sent them an email detailing the issue. Much to my surprise I was called about an hour later by Bob who apologized repeatedly and told me they would remake the panel within the hour and get it to FedEx and deliver Monday. While I hated that they had to spend the money air freighting a panel in to me, I appreciated their sense of responsibility. It's a premium product and they understand that service is very much part of the sale. 
It's all installed , looks great , and  I'd put it in again without a doubt."
2019-11-11,Dale Bauman,US,5,Great assistance to my questions and a…,Great assistance to my questions and a great product.  Installation was straightforward and very satisfied with the completed project.
2017-06-08,Michael Procito,US,5,I bought 3 beaded recessed panels fir …,I bought 3 beaded recessed panels fir my kitchen island . Great product. Dimensions were exact very good  quality . The finished product came out great
2023-01-15,Howard M.,US,5,What an amazing company,"What an amazing company! Upon receiving my initial order, Debbie reached out to me and helped adjust the design to meet the installation! They shipped all the parts quickly and were always available to help with any problems. All with no extra cost! The very best!"
2020-04-12,Scott Elia,US,5,"Outstanding service, excellent value",Outstanding service from the designer. Clearly knowledgeable and guided us on the best configuration for our room. Also great help with small details during install like edging and reveals. Great solution for moderately experienced DIYer. MUCH better than stock wainscot in big box.  MUCH less cost than hiring a carpenter
2019-12-23,John McCormack,US,5,Deb was a great help and allowed for an…,"Deb was a great help and allowed for an outstanding installation 
The product is great and customer service is outstanding"
2023-05-09,Richard,US,5,Great service.   5 stars!,Great service.   I made a mistake on my end.   I called the up.  They worked with me and got me back on track asap.  And great product.  2nd time using this product and looks great.
2023-04-28,Craig Allred,US,5,Excellent help in calculating the…,"Excellent help in calculating the proper sizes taking into account the odd angles.
This is my second experience using them and I have recommended them to several friends and will continue to do so."
2018-11-21,Casey Humphries,US,2,Not what I was expecting.,"Website states orders shipped in 5 days. I ordered on the weekend. So one would think the order would ship on the next Friday, which would be 5 business days from placing the order. My order shipped on the Tuesday of the following week. 7 business days from the time I placed my order. 

Also I needed a piece that was 95 inches, so I ordered an piece that was 96 inches. Little did I know, that my mounding would be cut to 94” for shipping. This little tidbit should be made much more obvious to purchasers. Not wanting to splice the moulding, I ended up not using the moulding on my project.

The quality of the product was top notch. Keeping the issues above in mind, I would not hesitate using this company for future needs."
2021-01-21,S. Marino,US,5,Extremely satisfied when I order from…,"Extremely satisfied when I order from Wainscoting America. Any time I’m not sure about our measurements, I call just to be sure and will always get the answers I need.  I’m done with my foyer and now on to my living room."
2020-05-23,Inez Medlock,US,5,Love my panels,"These guys were great! My panels are perfect!!
These guys are very caring and detailed with their work!!
They took the time to make sure that every detail, the placement of the fixtures, and overall esthetic appearance was perfect!!
Friendly and easy to work with!!
I am very happy !!
I highly reccomend Wainscoting America!!"
2022-11-30,Christine D'Ascoli,US,5,The Wainscotting was beautifully…,"The Wainscotting was beautifully executed, precisely measured, packaged extremely well and shipped out quickly. Excellent customer service."
2020-07-07,Joe  Leary,US,5,Excellent quality and very fast,Excellent quality and very fast. A great improvement to our staircase.
2017-07-06,Paul,US,5,I would buy again from Wainscoting America.,"Quick shipment, item was well packed, and received perfect.   Exactly as ordered."
2023-03-14,EPD,US,5,The best ever in terms of listening and…,The best ever in terms of listening and engaging on aesthetic and functioning wainscoting solutions
2017-08-04,Thomas Larsen,US,5,Excellent all around,Excellent all around
2020-12-21,Steven McHugh,US,5,The salesmen was very helpful to create…,The salesmen was very helpful to create the exact size and style .Quality of the panels excellent.
2021-02-11,Victory,US,5,Delighted with my purchase,Delighted with my purchase. Everything has been done on time. Good service.
2021-02-01,Daniel Booth,US,5,Impeccable service from start of order…,Impeccable service from start of order until delivery. Highly recommend them. Product is absolutely beautiful and super high quality
2016-12-20,John L.,US,4,"Overall good experience, but with some concerns.","The sales professional I spoke with (Bob) was extremely helpful over the course of several calls, even to the extent of creating the design to fit the parameters of my project.  The quality of the materials was very good.  The price paid for the materials was fair.  Unfortunately, the calculation of the angle of rise (stairway) was slightly off, but it is not noticeable enough to be a problem.  My biggest concern is the way that the product was packaged.  The packaging had literally come apart by the time the product was delivered to my home.  Luckily, nothing fell out or was damaged in transit.  They could do a much better job of packaging.  All in all, the finished product looks fantastic!"
2018-02-01,Dave Heckleman,US,5,I've used them several times and they …,I've used them several times and they are awesome to work with and the craftsmanship is great. Very happy with everything. Thank you
2016-10-28,Volker  S.,US,5,Great experience,They delivered on time and followed up before producing the panels to make sure design I submitted was correct. Would recommend them with no hesitation!!
2017-07-05,Rolf Westby,US,3,Good product,"Good product,  well machined and packaged.  Requires a fair amount of prep before painting esp. on the recessed panels.

Thought the water resistant upgrade was a little expensive as were the panels.
Shipping expensive too.

By the time I primed and painted the panels, I had a sizable investment into them.

All in all, a good product at a high price.  Not sure I will be ordering again."
2025-01-08,Dee Ann,US,5,Needed a sample piece of a chair rail molding,I needed a sample piece of a chair rail molding strip to make sure it would work with the planks in my older-model home which have a much larger lip/inset than what you can find in the big box stores nowadays. The staff was VERY helpful and sent me out a couple of small samples right away as promised. One of the two styles worked great so I will be ordering from these good people! THANK YOU FOR YOUR HELP!
2018-05-06,Jeff Hock,US,4,When the product was delivered to my…,"When the product was delivered to my house the box was split open. I was real surprised the product was not damaged. It might have been handled roughly by Fed Ex. I am sure you guys would not ship it that way. My only suggestion would be to protect the product inside the box a little more robustly. Other than that I was very happy with the panals, measurements were correct, my project is finished and looks great.

 Thank you

Jeff Hock"
2021-05-06,Brenda Replogle,US,5,Office Makeover,"We previously purchased wainscoting for our formal dining room, breakfast room and powder room. We knew we wanted to work with Deb and Wainscoting America for our home office makeover. As usual, Deb was simply amazing to work with. Everything went as planned and we took delivery of our new wainscoting approximately 2 weeks later. The hardest part is choosing the paint colors for our office. We recommend this company for their outstanding customer service and prompt delivery. Brad and Brenda Replogle."
2018-06-13,Don Yarbrough,US,4,"Good service, but...","Pros. Great service. Good product. Quickly replaced a panel that they had manufactured incorrectly. 

Cons. Could be packaged in a crate to reduce damage during shipping.  One panel was discovered with minor damage from a fork truck. Our carpenters agreed the could repair the scratch.  The panel that was mis-manufactured delayed finishing by a week. The reordered panel was the only excuse our carpenters needed to pull off our job."
2018-04-10,Steve Wagner,US,5,I have purchased from Wainscoting…,I have purchased from Wainscoting America 3 times and have never been disappointed in the product or their service.
2019-03-02,M M Bundock,US,5,Shaker wainscoting,"Absolutely beautiful, perfect, measured exactly and arrived right on time!!"
2022-06-21,C Kelly,US,5,Had to reorder material and it was easy…,Had to reorder material and it was easy and the staff was very helpful.  My packages arrived by Fed Ex ground and the company called when one box was delayed.  All the material arrived as we expected and in great condition.  We were able to order 150 lf of wainscoting and it all worked out perfectly.  We were able to adjust the rails to avoid outlets.  Worked out very well.
2018-05-02,Larry Brewer,US,5,Awesome Experience!,"From design to install of product, I couldn't be happier.  

I had tricky spots in my design.  Bob Muckle at Wainscoting America was a great over the phone with recommendations and the final design he worked up for my situation.  

The product was packaged very well and shipped within 4 days of placing the order.

The product itself exceeded expectations.  While produced by CNC, the corners of the raised panels were much sharper and cleaner than expected.  They even cut the slots for and supplied the biscuits for joining the panels together.  

I'm already planning my next wainscoting project and will definitely be placing the order with Wainscoting America."
2020-12-14,Tamara Sullivan,US,5,Happy with the experience,"Order came within the time frame promised.  I called with a question after receiving one of the 2 packages and they were very responsive, friendly and helpful.  Would recommend this company for anyone looking for quality, fair pricing and great customer service!"
2017-11-26,Pete Heredia,US,5,The product was perfect,"The product was perfect, and looks great. However the shipping was expensive to get to you."
2019-02-20,Jennifer Navarro,US,5,So easy to design and order your custom…,So easy to design and order your custom wainscoting!
2016-12-28,William B.,US,5,"Very accommodating, great website and called back the next day after ordering to verify any discrepancies",Would definitely use this site again
2023-01-09,F. Gast,US,5,This is our second order from…,This is our second order from Wainscoting America as our first purchase went so well.  I waited to rate our experience until we had our first purchase installed and completed.  This is an easy way to spruce up the look and even transform the way a room appears.  My advice to those considering this option is to MEASURE accurately!!  It will make your project go sooo much smoother.
2017-03-13,William T.,US,5,Great service!,Excellent customer coaching and service! Very easy to deal with.
2024-02-19,Harvey Warren,US,5,Thank you!,This was the second time we used Wainscoting America and we are certainly pleased with the quality of the their product and their customer service is outstanding.  Debbie came up with design solutions for our project to enhance the overall look.  Thanks again Wainscoting America for a job well done!
2023-08-29,Linda Mayger,US,5,The paneling I ordered arrived so fast,The paneling I ordered arrived lightning fast and was perfect in every way.
2016-09-07,David,US,5,Great Experience,I found Wainscoting America online and as I worked on my order I had questions. Called Scott at Wainscoting America and he went above and beyond to make sure my design data entry was perfect and that the design would work for me. He offered several suggestions to improve upon my plan. I placed the order on a Monday morning and on Friday morning it was being unload at my home in Indiana. Very impressive.  I did the install and everything worked as planned and looks great.
2022-09-15,Sally,US,5,Man cave bar front,Love the look.  Lots of help with measurements.  My bar looks great!
2022-03-30,Matt Sheehan,US,2,Some of the panels weren't cut to the…,"Some of the panels weren't cut to the desired measured size - one was off by 3/4.''  The special end cap pieces are very flimsy, break easily, and were not lathed uniform.  When you would try to line it up with the top cap - they weren't flush.  The lathing wasn't uniform in each piece - some at a angle, some weren't lathed all the way through, and some of the depths were different."
2021-11-22,Susan,US,5,The panels are beautiful,"The panels are beautiful. Deb was a huge help. The trim carpenter was impressed by the product. One box had a small ding, but luckily the panel only had minimal damage at the top and it was covered by the trim. Thanks! Susan"
2020-04-03,Bruce Rhoades,US,5,We were very happy with both…,"We were very happy with both Wainscoting products and trim, and appreciative of the support we received to help us complete our project."
2021-09-09,Paul Capozio,US,5,Panels were perfect his is our Third…,"Panels were perfect. This is our Third order from them and we are about to do a fourth. The detail in the panels shows up really well after painting which you dont get with thinner panels. It truly has a Millwork feel and look.  We did our  stair case, Upper landing, living room an now the kitchen to finish off  our custom cabinet island. all are showstoppers, the window surrounds they designed for us are the focal point if the living room. Next is the dining area and family room."
2020-10-05,Angela Wells,US,5,Good product,"Good product,  fast service"
2017-10-30,Mo,US,5,Amazing,"Amazing.  I am not very experienced in this stuff but i the fitting was perfect and i nailed it to the wall, did the sanding, caulking and painting myself.  Turned out great!"
2022-10-26,David Eck,US,5,So easy to work with,So easy to work with.  Deb and Bob were both great and product looks great
2022-01-06,Stephen Dunn,US,5,"Professionalism, attention to detail, and expertise","Professionalism, attention to detail, and expertise: that's what you get with Wainscot America. They're the best."
2021-08-02,Julia Sawyer,US,5,Beautiful product made in the USA.  Helpful staff.  Prompt delivery.,"Staff was very patient with me, an amateur.  Our job was shipped in five business, as promised.  The panels are beautiful."
2019-01-11,Annemarie Knoll,US,5,Excellent service and caring personel,"Excellent service and caring personel, not to mention fast delivery."
2016-04-19,Steve  Wagner,MA,5,Fantastic response time and simply a great product,"I placed my order on a Sunday evening in California and received notice on Tuesday afternoon that the product had shipped.  It arrived a week later well packaged, with every dimension exactly as ordered.  I couldn't be happier with the service and the product and will be ordering again soon."
2018-06-10,Joe Winston,US,5,Deb with Wainscoting America deserves…,"Deb with Wainscoting America deserves full credit in helping me design and order. From the start she was very professional and helped me with all questions and concerns. After a plan was agreed upon, each wall panel was marked. The install was successful and I very pleased."
2020-08-25,Carl Bloomfield,US,5,This is my second time ordering from…,"This is my second time ordering from this company. Again the process went very smoothly. The product is good and the turnaround time is very quick. I have recommended this company to others, one of which is a builder of custom homes."
2018-10-29,Jiam S.,US,5,I’ve been dealing with Bob,I’ve been dealing with Bob and Wainscoting America for the last 5 years with zero complaints. Top notch service and excellent quality.
2018-07-12,Justin Dozier,US,5,Wonderful company and product!,Wonderful company and product!
2017-09-25,Javin Cyriacks,US,5,Satisfied Customer,The website has great tools for designing the panels.  I also received assistance from the agents in doing some customization for a challenging stairway project.  It was easy to install and looks great.  Thank-you for all of your help!
2016-10-27,Henry L.,US,5,Easy to work with.,I am a interior trim carpenter and I wish all my suppliers were this easy to work with.
2025-01-22,John D,US,5,Loved the product,The wainscoting came in custom and pre assembled panels for easy installation.  Used a different vendor in the past and had to install individual standardized pieces.  Installation took a fraction of the time.  Happy customer.
2020-09-13,DM Beck,US,5,Received my custom wainscoting quickly,Received my custom wainscoting quickly.  It was perfect and as described.  Installation was simple for a do it yourselfer.  Great inexpensive option to add interest to a wall.
2021-11-29,David Bacher,US,5,Great product and great service,"Great product and great service.   Fast shipping. The only concern I have is in the longevity of the MDF, but I'm sure it will be fine.  In my application I want to install coat hangers, so I will have to anchor to the brick wall behind it (old house) but that's minor.
Overall it's a quick and efficient way to install wainscotting."
2020-04-16,Terry Looney,US,5,Great product,"Great product, install is complete and it looks great!"
2018-06-27,Steven  Amato,US,5,WOW. Looks Great,"Wow! I did not know what to expect. I ordered the wainscoting with help from Deb. It looks fabulous. 
I had my carpenter install it. It fit perfectly. It included small wedges to help center the electric outlets plates. They think of everything."
2019-06-10,Anita,US,5,Cap rail purchase a good one,I bought an 8-foot length of wainscoting cap rail. The rail was carefully packaged and arrived on time in excellent condition.
2022-03-03,David Braunscheidel,US,4,Delivery was slower than advertised,Delivery was slower than advertised. A few mistakes in sizes of panels and reverse moulding not sent. Was able to correct Wainscoting America cutting errors and Deb was very prompt and accommodating in sending additional components.
2021-05-11,Rose Fortman,US,5,First-time ever Wainscoting customers,"We have now completed two separate wainscoting projects using the services of Waincoting America.  We are extremely pleased with our experience.
Debbie is the WA representative we worked with on both projects.  She is a real professional,  very knowledgeable  and helpful.  Both projects went extremely well.  The WA product arrived in perfect condition and the measurements completely accurate. We highly recommend Wainscoting America."
2018-04-27,Umberto ,US,5,The product looks Great!,The product looks Great!! Everyone was a pleasure to work with from beginning to end. Deb was knowledgeable and a pleasure to work with over the phone and email. At pick up they even loaded the truck and gave ideas and suggestions to help me with putting up their product to look as good as if they installed it themselves. The staff is also always just a phone call away!!
2021-04-26,Matt,US,5,Second time using them,"Second time using them. Great service, panel came exactly as ordered and on time. Highly recommend!!!"
2018-12-13,John,US,5,We install the product in a highly used…,We install the product in a highly used bathroom over 4 years ago. Recently had a leak in the tub unit which required the replacement of the unit. We had serval contractors come in to bid the renovation. I was amazed that all noticed the wainscoating with a favorable response   Everything from “ now that’s the real deal” to “so where did you buy the wainscoating”. The product after 4 years in the bathroom environment showed no sign of wear.  If you want a great product buy it here. If you want to replace it later go elsewhere.
