Date,Author,Location,Rating,Heading,Body
2024-01-06,Colin Campbell,US,5,I have used Wainscoting America for at…,"I have used Wainscoting America for at least 8 years now on four different rooms and am completing a fifth now.  The software is simple and easy to use, the ordering process is also simple, and the final product delivered is well packaged and of great quality.  I thoroughly recommend this for anyone looking to save some time on millwork for an interior upgrade."
2025-01-31,Anthony Marsella,US,5,Great product,Great product.  Easily installed! 
2022-01-19,Pat Sim,US,5,We purchased in 2010 and are about to…,"We purchased in 2010 and are about to do our new home.  Service was excellent and support was awesome from start to finish.  We even made the ""hall of fame photos"" Look at the picture of under ""foyer"" and we lived in Raleigh so you will see that referenced!"
2017-04-06,Jana,US,5,Great customer service,Really great experience. I put in my request in after sending my pictures they call me back with a better option for me. I appreciate the extra step and the help they gave me.
2017-10-17,Charles M,US,5,Cant say enough good things about this …,"Cant say enough good things about this company. I thought the help they gave me on the phone was over the top but it pales in comparison to their product. Absolutely perfect!
Installation was a snap. Everythinhg fit together perfectly and it looks better than I ever thought it would.

Thanks guys, looking for my next project."
2021-06-26,Brad,US,5,Order was filled quickly and…,Order was filled quickly and accurately. They even called to ask me if I needed to change any stile widths (I didn't). And the delivery person was cordial and helped me get the product to where it needed to be. BTW it looks great!
2021-11-24,Andre Rogers,US,5,GREAT!!!!,GREAT Product and service. Made suggestions I did not think about which made product better!
2024-07-22,David Vega,US,5,Great communication and all about the…,Great communication and all about the details. Fast lead time.
2016-11-24,Becky S.,US,5,Just as ordered,"Talked to a very helpful Bob and he guided us through the process on how to tweak our wainscoting to our personal needs. I will admit that I was a little nervous about what to expect. When the product arrived, it was exactly as we wanted it. The quality is much better than what I have seen in stores. I do recommend this company to anyone."
2019-12-17,David Hasson,US,5,Great product,Great product - enhances your home with quality wood millwork.  Easy to work with staff and product comes beautifully packaged.  I want to do my whole house.
2017-06-29,Dale Allen,US,5,First class to deal with,First class to deal with. Very helpful.  I have had nothing but the best experience dealing with these people.  Some of the best packaging of their product for shipping that I have seen.  You can see pride in all they do!!
2017-02-20,Richard W.,DE,5,Very helpful customer service.  Very timely delivery.,Great service.
2021-05-06,Joseph Clemmons,US,5,This is an amazing company,"This is an amazing company. Their attention to detail along with their creative and consultative approach is outstanding. They are also very friendly,  accommodating and the quality of the wainscoting is superb. All companies should be this customer-centric!"
2020-01-26,Wayne W,US,4,Quality of the product is excellent and…,Quality of the product is excellent and well made.
2018-07-02,Dennis Veri,US,5,Excellent service,Excellent service
2017-01-25,Barry Y.,US,5,Outstanding!!,Customer service was outstanding and the product was top shelf.  Production and shipment were very quick also.
2018-10-30,Tim Montilla,US,5,Great product,"Great product, great service, great overall experience."
2016-11-17,Bill E.,US,5,Very acomidating and no surprises; an excellent experience.,Great design assistance.  Very detailed support and a truly custom experience.  They were a partner in our project and were always ready to help.  Could not have asked for more from them. Great company.
2022-09-20,David B,US,5,I have done multiple projects in my…,"I have done multiple projects in my home using wainscoting America and I have nothing but great things to say about the quality of the products, helpfulness of the staff."
2019-08-26,customer,US,5,I had a great experience working with…,I had a great experience working with Bob on a project where we used lots of product. Great listener and efficient scheduling.
2023-03-28,John Terrio,US,5,Very easy to order,"Very easy to order, and great support from Debbie."
2023-04-13,Andy,US,5,Great custom product,Got exactly the dimensions I ordered in one seamless piece packed with precision to protect from damage during transit
2019-10-03,Walter Burke,US,5,"Wainscoting America; the place to go for custom, affordable wainscoting!","Our experience with Wainscoting America was great from start to finish! Deb Summa was our contact at Wainscoting. She worked with us to measure accurately and completely. She made specific suggestions and added design features that added to the richness of the finished product. The wainscoting was fabricated and arrived quickly after our order. We installed it ourselves and it looks amazing!! (Installation requires some carpentry skill to cut angles on moldings, etc) We highly recommend Wainscoting America for their professional and skillful design and fabrication, as well as their personal contact, working with us to meet our needs over the course of the project.  The wainscoting is also very reasonably priced, considering it is literally made to order and quality material!"
2020-02-10,Happy Customer,US,5,I was pleased with the process from…,"I was pleased with the process from ordering, the checks made with me about some custom stuff I wanted (before they cut the panels) as well as the delivery process.  The product was easy to work with and to my surprise the seams were virtually invisible (and with just a little filler and sanding are now completely invisible).

The transformation of the room was remarkable."
2017-08-28,Don Adams,US,5,We ordered two 9 ft walls of paneling,We ordered two 9 ft walls of paneling. Everything was great. Good service and great product
2018-10-01,Bruce Jensen,US,5,Great product that gives great results,Great product that gives great results
2017-03-31,customer,US,5,Excellent product and experience!!,Excellent product and experience!!
2017-11-08,Carin Krasno,US,5,Terrific Product,Great products. Super simple to order. Love the design tool online. Many different design styles. Super quick delivery. Product just as promised. Very reasonably priced. Will order again.
2024-03-30,Bryan Ludwig,US,5,Great looking wainscoting ,"Great products, packaged well for delivery.  "
2020-06-18,William Rhodes,US,5,Exceeded expectations,Exceeded expectations. Really good quality at a really good price.
2018-01-24,Kevin Boline,US,5,Very nice quality,"Very nice quality.  Lot of help with the design phase, and we appreciated all of the patience when we made changes.  Everything was just as advertised"
2020-05-02,Joseph Giorgio,US,5,looks great and Bob was very detailed…,looks great and Bob was very detailed and helpful Tks Joe
2019-12-23,Angel Jia,US,5,Awesome!,Awesome job!
2024-06-04,David Mccullough,MX,5,Design specialist ,They helped me design the wainscoting going up my stairwell. Their patients and ability to help me order was great. 
2017-12-03,Peter Stahl,US,5,exceptional .,exceptional .. great product ... most of all great people!!!
2016-04-19,John Caravello,US,5,Quality product excellent customer service,"Order arrived with hidden damage by shipper.  Wainscoting immediately expedited a replacement, no questions asked."
2018-08-01,Lana Waters,US,5,Quick turn around and the panels were…,Quick turn around and the panels were exactly as expected!!
2017-08-31,Norm Froman,US,5,Great American Company,"This company is a pleasure to work with. They are very helpful and they make the process of measuring, ordering and installation a great experience. I would recommend them to even the lowest experienced DIY person to do this work. Debby was a real joy to work with on my project. Very helpful and knowledgeable about the measuring and installation processes."
2017-12-28,Rich,US,5,Great experience,"Great experience. They called with questions to ensure I got exactly what I wanted, and caught a measuring mistake(or 2)."
2023-02-02,Lenny L.,US,5,Another well done custom product !,Another well done custom product !
2022-10-06,Regna Ape,US,5,Excellent Products and Customer Service,"This was the second time I purchased wainscoting from WA. Both times were great experiences, their customer service is superb. The wainscoting is absolutely beautiful and a perfect fit."
2022-10-28,Ralph Grimm,US,5,1st time with them,1st time with them. Wonderful service and product. Will be using again. Best find on the internet for me this year. Thank you!
2020-05-03,Russell Hornik,US,5,Very pleased with the quality of both…,Very pleased with the quality of both the wainscoting and the mouldings.
2017-02-19,customer,US,5,Great product at great price.,Order was shipped on time and in a very secure package. It is going to add great look to our formal dining room. Called the staff about some questions and they were very helpful. Would recommend Wainscoting America to everyone.  Number 10 in my book all day long!!!!!
2022-04-13,Jack Maggiore,US,5,Excellent Company and amazing customer…,Excellent Company and amazing customer service
2018-02-21,Bob Marconi,US,5,Panels were installed tonight & look…,Panels were installed tonight & look great.
2020-03-02,Cynthia Hethcoat,US,5,Experience,Ordered bead board. Quality material. Great service.
2021-03-28,Jane Hamilton,US,5,Quality Product,A custom high quality product.  It was properly packaged to withstand some box damage without damage to the panel.
2022-10-01,"Lori Novak, Springfield, IL",US,5,What a great company,"Debbie patiently answered all my questions, gave me great ideas, helped figure out my measurements and made the order process easy. Some panels arrived damaged, but Bob made sure they were replaced within days. The product is very high quality, and the room looks beautiful."
2016-04-20,Mark Wisniewski,US,5,Love the product.,"I've ordered 3 times and every time the order comes in exactly as ordered.  The product is really great and looks great once installed.  In addition the tips are also right on (i.e., the primer they recommend worked really well on the product, just one coat of primer and one coat of paint and it looks perfect).  They also really do ship out within a week so plan accordingly, and don't be surprised if the delivery truck shows up with a huge pallet full of your panels (which are expertly packed), chair rail, and pediment's."
2018-07-31,Sister Clare,US,5,Best in generosity,Really helpful in quickly supplying us with the trim we needed in time for the opening of BLITHE SPIRIT. (Elements Theatre Co)
2020-06-16,Chris Williams,US,4,The product arrived a few days later…,The product arrived a few days later than expected.  However it was of excellant quality and packed very well so no broken edges.  I only wished they would have sent some fillers for around the outlets so we did'nt have to construct our own.
2019-03-12,Douglas,US,5,I was very pleased with the product,"I was very pleased with the product.  Everything was correct.  I did have an issue with the delivery though.  Seems its delivered in a 53' semi, which can have difficulty navigating small streets.  I had to meet the driver a mile away, and then load the panels into my SUV, which was just big enough.

One tip which would have been nice to find on the site, would be to consider ordering the panels 1/4"" shorter than needed, if its part of an inside corner.  That way, if your wall isn't exactly vertical, you can still have the panel fit, and if its a bit short, fill the top of the gap with caulk and no one will know."
2020-11-12,Truly Happy Customer,US,5,Excellent Product,"Excellent Product, the team went above and beyond helping with custom design and the finished product has transformed our home. Deb (the lady we worked with) was professional, responsive and there was not one call or message she was not prompt and responsive. I've already recommended their product to my friends and family!"
2019-04-13,Marla,US,5,Everyone was wonderful to work with,"Everyone was wonderful to work with. Pleasant, knowledgeable and so helpful. The panels came quickly and were easy to install. They are excellent quality."
2017-09-22,Mike S,US,5,Great experience,From assisting with the design and measurements to timely delivery our experience with Wainscoting America was great.  The panels have transformed the aesthetics of our house.  Would definitely recommend.
2017-03-20,Kenneth Mathys,US,5,Excellent,We received our order as planned. It is very easy to install and paint It turned out beautiful and we love the new look of our dining room.
2017-05-24,Robert Harris,US,5,Nice product!,Nice product!
2021-11-25,Bill Freeman,US,5,Deb and staff were excellent in…,Deb and staff were excellent in coordinating the measuring and procuring of the panels
2017-04-17,Cheri Palmarchuk,US,5,Great product,Great product! Awesome customer service. I would highly recommend this company.
2017-06-09,Dennis McCarthy,US,5,Great Company & Product,"Reliable, helpful, accessible, completely professional company with a great product!"
2022-12-19,customer,US,5,Everything was good,Everything was good
2024-03-18,Kathy Martynowski,US,5,Do wainscoting the right way !,"The most beautiful and convenient way to install wainscoting in your home. The company is very helpful,fast and efficient. Simply the best!!!"
2020-05-08,Julie Whitehead,US,5,The product is high quality,The product is high quality; the shipment/response was speedy. Great service!
2017-12-06,Chad Elks,US,5,Delivered fast and exactly what I …,Delivered fast and exactly what I ordered
2022-04-24,Debra Davis,US,5,Such professional services and reviewed…,Such professional services and reviewed promptly!  Thanks so much
2021-07-31,John Bills,US,3,Dining room wall,"The website is very easy to work with. The design feature is very helpful in creating the look you want. The order was fulfilled and shipped promptly.
The product arrived in a timely manner and was easy to unbox.
some improvement you cold make:
My design has four panels they all came marked with a #1. Would have been helpful to have them marked one-four as they would be assembled on the wall. Would have been helpful to have included in the package a picture of the design as built. Some imperfections on one of the panels that my painter will need to fix."
2020-04-23,Ray La,US,5,Very satisfied customer,My order for wainscoting was delevered on time and is of excellent quality. Finished nicely with paint and came out very good. we are very satisified and would highly recomend.
2017-01-22,Annie M.,US,5,Flawless Transaction!,Excellent seller; quality products; highly recommend!
2017-10-30,G Prado,US,5,Great product and great customer …,Great product and great customer service.
2023-01-07,Van Malinosky,US,5,Total Satisfaction,"After ordering and receiving a wall panel, we discovered that the measurements of the panel did not match our order exactly. We contacted the company, and they were apologetic and re-cut a new panel with no questions asked. Both the quality of the panel, and the customer service from this Company were excellent."
2022-03-08,Arthur Smith,US,5,The best company I ever dealt with with…,The best company I ever dealt with with Bob is always there to answer the phone and has all the answers what a great company
2021-07-15,Faye Jagger,US,5,As we were helping my son's family…,"As we were helping my son's family prepare for renovation of their Powder Room, I Googled for examples of powder room design ideas.  Suddenly, I saw a website pop-up for Wainscotingamerica.com.  As soon as I saw the nature of what you do and the panel options, I turned the research over to my husband who has a long history of  construction experience.  After accumulating the room measurements and other details, we contacted a representative, Deb Summa.  She quickly took us through the initial evaluation of our project and presented us with an estimate (including shipping).  From that point forward, we were amazed at how rapidly the process moved!!!  Deb's quick mind and absorption of our room, electrical outlets, recessed TP holder and the desire to center the vanity to the panel design moved the plan from ""drawing board"" status to production!!!!  We  were astounded at the ETA from Deb to the actual real time experience!!!  She was truly a joy and consummate professional . . . fully knowledgeable!!!
When the panels arrived we were immediately thrilled with the quality of the product!!  As the panels were then installed, we continued to be amazed by the precision of EVERYTHING!!!  The project was completed in time for a big family gathering held this past Sunday (July 11th).  Everyone was so impresssed.  We are now making plans to use wainscoting on the stairway from the main floor of my son's home to their finished basement.  We will soon be contacting Deb to take us through that!!!
It seems likely there will be several of our friends and relatives contacting you and your website regarding their own project ideas.
We are so grateful for the ingenuity and cleverness of your product and the fact we receive such rapid delivery from Conneticut to Indiana!!!
We are forever grateful!!!
Faye Jagger  (Project Manager at my son's home)"
2017-07-28,Julie Bucholtz,US,5,Fast,"Fast, high quality and professional.  Need I say more"
2018-11-04,Curtis Thomas,US,4,good product,"good product, excellent adherence to specifications, nice people. Only problem was not getting materials in the promised time frame"
2017-02-21,Harold B.,US,5,quality product with quality service ...,very happy with the product and the personal that helped me with ordering..I am a repeat customer...
2018-12-02,Patricia Rise,US,5,Made and delivered exactly what I…,Made and delivered exactly what I wanted and it fit the intended spot perfectly.
2023-12-20,Jorge Lopez-Zuniga,US,5,Great Customer Service!,The great customer service and the high quality of their products exceeded my expectations in every way.
2017-08-09,Shannon Cave,US,5,Great experience,"Great experience!   I told them what i needed, sent a picture and 2 measurements and they did the rest! Got my piece in one week and its perfect
Effortless!"
2016-04-20,Michael Davino,US,5,Excellent!,"Excellent product, timely delivery, and great customer service! The staff will work with you to get it right the first time. Finished product looks great. Just like the pics in their website."
2016-07-20,Haakon A.,US,5,Phenomenal service!,"Outstanding product.
Very helpful during design phase. Always available to answer ""dumb"" questions, and super helpful."
2016-04-20,Jeff Harrison,US,5,Excellent,Very helpful.  Great product and service.  Highly recommended.
2020-03-05,Greg Sinclair,US,5,I used Wainscoting America’s product in…,I used Wainscoting America’s product in my dining room.  I was very satisfied with their product. Their measurements were accurate and the materials were of high quality. It was shipped a few days after I ordered it. Installation was easy.
2022-12-17,John Sheets,US,5,Glad to have gotten such a high quality…,"Glad to have gotten such a high quality molding. Easy to order from the website, grateful for confirming emails."
2017-04-26,Jesus Galindo,US,5,Great service and craftsmanship!,Great service and craftsmanship!
2016-10-27,Cayce T.,US,5,Bob muckle,"Bob muckle is a pleasure to work with. We have ordered from him twice and both times he was there to help in measurements, time management and re-orders. Thank you Bob!"
2024-12-04,Jane L.,US,5,Wonderful experience start to finish,Wonderful experience start to finish - their expertise helped us with this home project and the result is gorgeous!  They could not have been easier to work with or more responsive. Incredibly fast shipping and beautiful panels!  Thank you! 
2019-04-09,C Stock,US,5,Quality through the roof,Awesome quality. Showed up to exact size. Nice work. Would order this over the stuff from Lowe’s or Home Depot everyday and twice on Sundays.
2017-06-06,Joseph O'Brien,US,5,Excellent experience,"Excellent experience, great product"
2021-06-16,William Gruber,US,5,The service is fantastic!,"The service is fantastic!  it is such a pleasure to work with a company that truly cares about the customers needs and expectations.
I have ordered from this company on two (2) separate occasions in 2017 and just recently in April - May 2021.  I highly recommend this company to anyone interested in improving their home or have a need for Wainscot panels.  Not only is their website easy to use but most importantly the service that is provided by just picking up the phone.  We love this company!"
2022-06-06,Raymond Nebiker,US,5,Great product easy to use and install,Great product easy to use and install. Fast delivery and great customer service!
2019-08-02,Derek DiMeo,US,5,Awesome company,Awesome company
2022-10-30,Alexandra,US,5,Samples arrived….,I ordered some samples and they arrived very quickly. It will help me decide what one I would like to use for my home.
2020-03-25,Terri,US,5,Great experience,"Great experience, quality and overall value. I would highly recommend this product."
2020-06-22,Julie Long,US,5,Bob was easy to work with and a…,"Bob was easy to work with and a perfectionist. If we need more product in the future, we will definitely call him."
2018-01-20,Fred Wood,US,5,Great customer service from the first …,"Great customer service from the first phone call until the products were delivered and installed.  Everything arrived safely, without damage,fit perfectly as ordered and left my installation contractors with a very positive impression.  The wall is beautiful and I would recommend Wainscoting America to anyone who is looking to purchase wainscoting. Great purchasing experience."
2022-07-19,Eduardo Trujillo,US,5,"Easy ordering,great packaging and…","Easy ordering,great packaging and overall really nice product. Thanks!"
2019-09-25,T. Miller,US,5,Will order again,Product was well made and arrived within six business days of order to Colorado.  Beautiful results.  We will order from Wainscotting America again and we have been recommending the company to our friends.
2020-11-26,R Damon Moss,US,5,My order came wrong....Deb and team…,My order came wrong....Deb and team fixed the problem immediately
2017-08-31,Tom Hughes,US,5,It was a most professional experience …,"It was a most professional experience working with Bob on my orders. He was so great to work with and very patient with all my questions. 
The quality of the products is first class. 
We are very pleased with everything."
2016-10-28,Colin L.,US,5,Great company and product!,I highly recommend WA. They have an amazing product and the best customer service one could imagine!
2016-11-11,Nathan L S.,US,5,"Excellent communication, unique product offering","I received the order in a very timely manner which was expertly packaged and paletted.  This company offers a very unique product, being able to custom order to fit your space is great, and the instructional videos on measuring are great.  The quality of the router, trim and accessories is excellent, requiring little to no prep work prior to finishing.  Pricing was also comparable to what you would pay to purchase non-customized wainscoting materials off the shelf, or to purchase the raw material and router yourself.  Time, cost and quality were all excellent.  The website was a little tricky, but all it took was a phonecall to figure out how to specify certain things.  Taking accurate measurements is critical and requires some thinking in many cases, so it's not a simple process and easy to get wrong, which of course is on the consumer and not the company, so measure a few times to be sure and pay close attention to the reveal dimensions around doorframes.  In my case everything fit perfectly and I did not fumble any measurements after studying their instructions.  The product looks great, the customer service is top notch and I will definitely do business with again."
2018-11-17,Jessica ,US,5,I really appreciated the amount of time…,"I really appreciated the amount of time and attention to detail they gave in helping out with the design/order process.
There was a snafu in our order and it initially arrived with several panels cut to the wrong height.  However, they were very responsive and corrected the issue right away with new panels shipped out to us immediately.  

Overall, the design process is smooth, the product is great and the customer service is excellent. I would gladly recommend them to anyone I knew who was interested in adding wainscoting to their home."
2020-07-09,Dan Rufrano,US,5,best people to work with,"best people to work with , great"
2019-10-22,Paul Weber,US,5,Delivered as expected to my…,Delivered as expected to my specifications.
2022-05-13,Joe Wilson,US,5,I love my Wainscoting from Wainscoting…,I love my Wainscoting from Wainscoting America. I looked all over and found most options were plastic.  I didn't want plastic.  I wanted the real deal and I got it.  Deb was so patience and helpful.  I installed it myself without a lot of hassles and it looks great!  It's the highlight of our remodel.  Thank you!
2016-10-27,hugh d.,US,5,got what I wanted,Great product.  Great service
