Date,Author,Location,Rating,Heading,Body
2020-12-01,Martin Rosensteel,US,5,Great product and was easy to layout…,Great product and was easy to layout the design based on the website design tool. End product was just as expected. My contractor found wainscoting easy to install and saved him a lot of time.
2019-03-06,Vincent White,US,5,Excellent product support and delivery,Excellent product support and delivery
2020-08-28,Annmarie Healy,US,5,Great Company,Great Company. Excellent service. Highly recommend
2024-03-08,John Grave,US,5,Great Service and fast turn around time,"Fast service and very good ordering process, fast turn around"
2016-10-27,Steve S.,US,5,Outstanding product AND customer service!,"Wainscoting America does business the old-fashioned way.  They make a great product, work with you to make sure you get what you expect, take a personal interest in your satisfaction, and then back it all up with great customer service."
2017-10-18,Gregg Berger,US,5,The staff and product are world class!,The staff and product are world class!
2016-10-28,gary meyer,US,5,Great Service,"The companies service and assistance was great. My project turned out great, and I get a lot of compliments."
2019-11-11,Kathy Hecimovich,US,5,We received the Wainscoting in a very…,"We received the Wainscoting in a very timely manner. It arrived well wrapped with no breakage or chipped edges. The finished product looks great. I only wish we could have had the electrical outlet cut out by you. We could not change the location , and it just happened to locate between the two panels that fit together. But it all came out ok. Thanks for a great product."
2020-11-14,Scott,US,5,Tall wainscot in sitting room,Used a tall wainscot in sitting room as an accent wall   Painted gray looks excellent
2018-07-10,Frank Girard,US,5,excellent company,excellent company
2024-10-24,RS MacNeil,US,5,Deb is so great!!!!,Deb is so great!!!!
2020-08-30,Steve P,US,5,Nice customized cuts that fished off kitchen cabinets.,"Bob was great in accepting custom requirements for my Shaker kitchen cabinets. The cuts were all precise so that everything fit perfectly, and I was able to add a nice finished looked to the cabinet ends and the bar/island. The delivery was fast and the panels were well packaged to prevent damage. I’m very happy with their service, and I would highly recommend them."
2020-03-13,Michael Fredrick,US,5,Performamce,I have been ordering from them for over 9 years and they are Always helpful and always a perfect fit.
2016-11-17,Douglas W.,US,4,cabinet panels,"The panels look nice but our didn't  paint consistenly.  They asborb the paint differently in areas.

Update 12/212016, yes they followed up and were very supportive. I believe our expenience may have been unique since we were trying to match a kitchen cabinet grade finish.  The finish on the panels are find."
2024-06-11,C. Carlson,US,5,Great customer service,"Great customer service, helped me pick a product and made suggestions. Product shipped quickly and was as advertised."
2019-12-12,Jim Zahn,US,5,Excellent packaging and perfection in…,Excellent packaging and perfection in the milling work.
2018-12-09,Wendy Sayer,US,5,Wonderful service and the finished room…,Wonderful service and the finished room looks amazing. I would use them again.
2021-11-20,Maria Jorgenson,US,5,Our fireplace turned out just how we…,Our fireplace turned out just how we envisioned it. Wainscoting America was very helpful and called to confirm some things before starting our project which allowed us a chance to ask questions about installing. We are so happy with how everything turned out!
2022-06-20,Gary Wallace,US,5,The wainscoting was everything that I…,The wainscoting was everything that I wished for & more! The quality is outstanding along with the customer service.
2023-04-05,customer,US,5,Product is easy to order,"Product is easy to order, high quality, when you actually get it it is even better than one expected!"
2016-12-30,Michelle L.,US,5,I work for a general contracting co …,"I work for a general contracting company and have worked with many vendors and I have to say, Wainscoting America has the most wonderful customer service and amazing communication.  They really care about your project big or small and are always willing to help.  We purchased our first set of panels for a project recently and the product is also great.  I hope we have another project soon that will require wainscoting because I want to work with them again."
2017-11-24,Mary Brienza,US,5,Excellent customer service and an …,Excellent customer service and an excellent product. Every contractor that I showed this to was impressed with the quality. The installation was a breeze and instantly elevated the look of our kitchen.
2023-06-09,Katie Petros,US,5,Wainscoting America- 5 star Customer Service!,Working with Wainscoting America felt very personalized and easy to resolve issues.  I was on an expedited time schedule and they did everything they could to meet my needs.  We had some issues with delivery and they resolved them as soon as possible. Deb was extremely attentive and went the extra mile to provide exceptional customer service.
2022-08-04,Andrew Rodriguez,US,5,Doors,The doors I ordered were perfect. The fit like a glove. Great job and I would recommend your company to anyone.
2020-08-08,Brad ,US,5,Perfect fit beautiful work,Perfect fit beautiful work
2018-10-30,Barbara Drzymkowski,US,5,Beautiful molding,Very nice molding. Beautiful design. Precise cuts.
2021-02-03,RIck B,US,5,Totally recommended!,Wonderful to work with! Very helpful with designing and resolved an issue with a damaged shipment without any hesitation and rushed the replacement. Would absolutely recommend Wainscoting America for any Wainscoting needs!
2017-11-01,Roger Oxee,US,5,Do you want to increase the value of your home?,. Great product! They are great to work with and work hard to make sure that the customer is completely satisfied
2022-08-25,Tim,US,5,Placed the order use the design tool,Placed the order use the design tool. I was contacted to see if I confident with the measurements or needed assistance measuring the project. Received the order within 14 days and found two small filler boards were missing. Contacted Wainscoting America who apologized and sent out the missing boards that day. The stair wainscoting project turned out great thanks to the quality of Wainscoting America. Will definitely recommend Wainscoting America to friends and will use their products in future projects
2020-10-16,Victor Rodriguez,US,5,Beautiful!,The wainscot panels are beautifully made. Even the contractor was impressed with the quality. The service was outstanding as well. Will order more panels in the future.
2018-11-14,Maureen Kennedy,US,5,They went out of their way to get us…,"They went out of their way to get us the panels in a timely manner.  They had run into a problem which could have delayed us receiving them and held up our project. At their expense, they cut the panels and shipped them immediately.  Easy to deal with.  Friendly, helpful, informative staff who were great to work with."
2020-12-15,customer,US,5,Great Product,"Great Product. Precision dimensions, easy to use. Great packing. Thanks!"
2025-04-26,Randy Hartenstine,US,5,Working with Wainscoting america was…,"Working with Wainscoting america was amazing! very kind professional and very detail oriented...Mrs Debbie is always on top of her game catching all the little mistakes and she knows that stuff inside and out and will alway go out of her way to make the project run smoothly and process everything correctly!

thanks so much hope my panels are good and my install goes well
Randy"
2023-04-17,Joohyun Ro,US,5,Great Product!,"Easy to design, easy to install, and best of all - looks great when done even for someone like me with minimal ability or experience.  Completed the project for one room and was so pleased I took on a second project.  The only challenge was in handling a panel at its maximum length as these are made very sturdy and thus pretty heavy (also explains the fairly steep shipping charges)  Customer service was also great in that there was an error with my order and the company responded quickly and worked with me in coming up with a fair/win-win resolution."
2022-09-11,Dave,US,5,Top quality with accurate dimensions,Top quality with accurate dimensions.  Highly recommend and would use them again.
2016-04-20,Jack Afarian,US,5,Wainscoting of America is an Excellent company,"I recently installed wainscoting in my dining room.  I purchased the panels from Wainscotingamerica.com and am totally satisfied with both the quality of the materials, the ease of installation and the superior customer support that I received from their staff.  After I completed my measurements I talked with them on the phone to finalize the numbers I received exceptional guidance which resulted in some changes to my measurements.  The end result was a perfect set of panels that has transformed my previously bland dining room into a showpiece.  I highly recommend Wainscoting of America to anyone who is considering installing wainscoting ."
2017-12-05,Peter Stissi,US,5,Great customer service,Great customer service! helpful design team and quick delivery! a win win! And the product looks amazing installed..
2021-12-06,Ryan Anderson,US,5,Friendly,"Friendly, quality product and good lead time"
2019-10-10,Leon Markowski,US,5,Great dealing with people that are in…,Great dealing with people that are in the know about their product. Speedy service and great quality.
2019-10-02,Edward Jaynes,US,5,AWESOME COMPANY                                                                                                     AWESOME COMPANY Wainscoting America is a company that I…,"Wainscoting America is a company that I have used on several projects and on my own personal houses. They are the nicest people to work with. Always there to answer any questions you have. The service is the greatest. My Wainscot was always on time.
I give the Company a 5, if there was a 10 they would get the 10.
I recommend them to anyone that needs a great product."
2024-03-25,David D'Ancicco,US,5,Absolutely the best experience …,The craftsman who make up the business are simply the best.  They followed me through my project providing expert advice and support.  The quality of the product is flawless and looks absolutely amazing.  I can’t recommend them more highly.  
2020-12-05,Barbara-Ann Horne,US,5,Amazing product!,"Amazing product! Cut exactly to spec, solid product, made the job so much easier, absolutely worth the money!"
2017-05-14,John Migliaro,US,5,Great product for the money,Great product for the money.  I'm a professional cabinetmaker and we can't make these panels for what they cost from Wainscoting America.  Sizes were perfect we did not have to make 1 cut to install.
2019-12-10,David Kavis,US,5,I was very pleased with my order,"I was very pleased with my order.  Product was delivered on time, shipped in great shape and beautifully produced. Also I must say customer service was great I would definitely order from them again."
2022-07-15,Bill Wiseman,US,5,Great people and great product,"Great people and great product
Have had many compliments on the stair wainscoting"
2021-11-20,Wayne D,US,5,The wainscoting I ordered came very…,The wainscoting I ordered came very quickly and looks great in my bathroom. I used the website to order and input measurements. I would order from them again.
2020-03-22,Jeff Riley,US,5,I placed my order thinking I did all…,I placed my order thinking I did all the right math for my Wainscoating. Spent a few dollars on this stuff so I took my time with it too.  I Received a phone call a few days later to go over my order measurements and turns out they were slightly off. They could have just sent out what I ordered. Thanks for having people who actually care that you’re happy with what you order.
2017-01-21,Raymond M.,US,5,No Stess,These people really know what they're doing. They made the whole process easy. Deb was meticulous with the measurements that I sent and helped me work out some really challenging areas in my dining room. I have an older home. I would use them again without hesitation
2017-12-28,Paul ,US,5,Customer service was exceptional and …,Customer service was exceptional and product arrived undamaged because of the packaging care. Would highly recommend them.
2019-08-14,Jasmin Becker,US,5,Wonderful easy experience over the…,Wonderful easy experience over the phone figuring out the exact size needed for room dimensions. My carpenter was very impressed how easy it was to put up. Thank you!
2021-01-25,Eileen Papa,US,5,We have ordered from them several…,"We have ordered from them several times. Every order was delivered in record time, and each order was exactly what I had ordered. Great to deal with and a great looking product."
2021-11-18,Gregory Bush,US,5,Great quality,"Great quality, timely delivery
Great price."
2020-09-05,Juan Williams,US,5,Another satisfied customer,"Debbie was amazing, extraordinarily patient,  and really CARED!  Bob is an excellent owner of the business and is VERY fair and works hard to make sure that his customers enjoy an unforgettable experience!"
2017-08-21,Joseph Roth,US,5,Wainscoting America delivers a …,Wainscoting America delivers a wonderful product with amazing customer service.
2016-10-27,Wendy F.,US,5,Well worth the money,"I couldn't believe how easy it was from ordering to installing. My Sales rep Bob M. used my measurements and out figured out what was needed, and made suggestions on coordinating pieces. Once it all arrived, it was numbered according to the layout, and we were able to install it in no time flat. Couldn't be happier!"
2022-02-11,Kathleen Gale,US,5,Excellent customer service and product!,Excellent customer service and excellent product!  This is truly a company that takes pride in their product with old-fashioned customer service that is hard to find.
2020-05-26,Ben Barrett,US,5,THis is a great product,"THis is a great product.  The only class I ever got an F in was wood shop.  Needless to say carpentry is not one of my skill sets.  These panels worked great.  Just don't look to close at the corners that required miter cuts.  However, caulk and a really good paint can be your friends.  I am now thinking about adding this to a couple of more rooms to my new house as it gives the traditional craftsmen look.  Thank you. Ben Barrett."
2020-07-29,K Henthorn,US,5,Out standing product,"Out standing product, could not believe how well it went together and how great it looks for a nonprofessional installation.   My wife can not stop showing it off. I will also say Wainscoting America has thought this out to all the way"
2021-09-02,Rachel Stietzel,US,5,They are the best~Professional,"They are the best~Professional, attentive, and care about their work."
2018-05-13,Alan Blake,US,5,All good,All good. The website was informative and user-friendly; the panels I ordered were of good quality and arrived promptly.
2016-05-20,Mina S.,US,5,Elegant dining room,"I had my dining room done by WainscotingAmerica, it is so beautiful and  elegant, it's better than I ever expected. We get so many great compliments on that space,that I would love to do other rooms in the future. I highly recommend WainscotingAmerica for their great work and professionalism, and I can't wait to get started on the rest of our house!"
2025-01-29,Peter Simone,US,5,This is the 3rd time we've ordered from…,This is the 3rd time we've ordered from Wainscoting America. We are very happy with the quality of the materials & the assistance given us by the staff.
2021-12-17,Gary Bachman,US,5,We absolutely love our Wainscoting,"We absolutely love our Wainscoting.  We can't wait to order more
for our home.  Thank you so much!"
2019-09-15,Edward Saddler,US,5,Great Product,Great Product
2018-09-07,Millton Villinger,US,5,Everything that is advertised is true,"Everything that is advertised is true. Shipping time was fast. Panels were packaged perfectly so they arrived undamaged. 
Installation was a breeze. Accuracy of the panels amazing. The sales woman was extremely knowledgeable and  helpful with the order. I would recommend this product to anyone doing wainscoting."
2018-02-07,Keith Keenan,US,5,Outstanding product,"Outstanding product, fast shipping, staff is professional and extremely helpful."
2022-09-15,Anne Marie Hanlon,US,5,They do beautiful work,They do beautiful work.  And FAST!
2020-05-30,E Cummings,US,5,Very easy ordering process,"Very easy ordering process. We love the product, it looks great!  I highly recommend Wainscoting America."
2023-09-09,Somma Development,US,5,Great product for a great price,"They work with you on complicated designs and keep at it (even after delivery) until everything is right.  Quick design, fast production, and efficient delivery all for a great price. Will definitely use them again."
2021-09-29,Debra Young,US,5,I absolutely LOVE Wainscoting America,I absolutely LOVE Wainscoting America! I designed and they made to perfection my custom panels back in 2013 when I had a major flooded basement...a family room and 2 bedrooms!  The installers had absolutely no issues installing the panels and I loved the whole look!  Fast forward to this past year and I have had to reach out to them TWICE for separate water issues to have replacement panels recreated. Not only did they still have my original order and measurements but they prepared and quickly delivered the new replacement pieces in just a few days.  Customer service is the absolute best!  I highly recommend them!
2023-11-07,Fraser C.,US,5,Right every time,"I have now ordered on three different occasions and have been extremely pleased every time.  The work is absolutely to specification, the turn around time is short, communication/ordering is easy, and the customer service, including custom design consultation, is part of the process if needed.  Highly recommended."
2019-08-10,Dean McCreary,US,5,The product is easy to order,"The product is easy to order, and if you happen to need something that doesn't fit their order system, they are very helpful on the phone.  Product is shipped when they tell you it will be, and you get exactly what you expected.  I've ordered several different times, and each has been a pleasant experience."
2018-04-20,Aurthur Howard,US,5,Great service!,Great service!
2023-02-07,K_Ball,US,5,Great support and Project looks great!!!,The Wainscot really makes our great room a feature.  We just finished installing a travertine floor and the Wainscot complements it fabulously. Debbie is the best. Thank you so much Debbie for all your help.
2023-12-21,Dominic Linnenkamp,US,5,Experienced design service and quick…,Experienced design service and quick back-end order resolutions.
2021-07-27,Kathy,US,5,Consistently good quality wood products…,"Consistently good quality wood products & quick delivery, too.  Grateful to find a business that will supply clear, stain grade poplar.  That has proven harder to source than it should be.  Thanks for being that reliable source, Wainscoting America!"
2016-11-07,Kerry B.,US,5,Great Service,Service was great as was the advice! Everything went very well on installation and all product arrived promptly and undamaged. Would definitely use use again!
2017-04-01,Ray,US,5,Great quality,"Great quality, fast shipping."
2019-11-24,Nicholas Mastracchio,US,5,The staff at Wainscoting America were…,The staff at Wainscoting America were fantastic! They were so accommodating and easy to work with. I would recommend them to anyone.
2025-02-07,Greg,US,5,Have used for several orders,"Have used for several orders. Deb Summa has taken the time on each project to transform the plan and the materials/supplies to exactly what I needed.  
A+"
2018-08-16,gary koehler,US,5,better than hoped,"My wainscoting arrived in perfect shape due to excellent packaging much sooner than expected, was better machined than hoped, and Deb made ordering over the phone simple for those who prefer that over computers."
2018-06-27,Sean Sullivan,US,5,Downstairs Bedroom,This latest project using American Wainscoting was my third successful project. I love this product!  You will as well. Simple and easy installation as well the ordering process.
2022-11-08,JRG,US,5,Great quality and service.,Great quality and service.
2021-06-26,N Hackett,US,4,"Good product, easy purchasing","The ordering process was simple and my order came quickly.  The product was exactly as expected (and well made).  
My only issue was that no one answered the phone number listed on the website.  I called several times about an order and got no answer or recording, although someone did call me back using a different number."
2018-07-05,Dan Gartner,US,5,We are a residential contractor in…,"We are a residential contractor in southeastern pennsylvania and have worked with WCA many times on multiple different projects.  The customer service and response times are always phenominal, not to mention the level of detail they are willing to provide as far as installation and dimensions go.  Great experience every time, great product!!!!"
2019-05-25,Tony Gallo,US,5,everything went as planned,everything went as planned. Panels fit well and required only minimal sitting which was due to old house with not perfect walls.  Just make sure you have sufficient backing horizontally to secure
2020-10-23,Paul,US,5,I cant say enough about the service and…,I cant say enough about the service and design help I received when ordering the panels. They shipped quickly but that is where the ball got dropped. The shipper never called when the product was at their facility. Then they missed the dates of delivery.
2016-11-17,Shawn M.,US,5,Great Company,Great company to work with.
2018-06-02,George Bacon,US,5,The Wainscoting panels made to order!,The Wainscoting panels were made quickly and to the dimensions I requested. After painting and installation they look great!
2017-05-01,Customer - Ken (from Florida),US,5,Phenomenal experience!!!!,"Phenomenal experience with this transaction! Great telephone conversations with our salesman/phone contact ""Bob,"" the product was a true fit, the panels were beautifully cut, styled and constructed. They shipped unharmed and the price was truly unbeatable. This stuff is NOT the cheap MDF you can buy at a home improvement store! This is very thick and sturdy material admixed with wood. The complements keep coming from our house guests and several people were so impressed that they immediately asked to WA contact information. We had a contractor working in our home already and he took care of the installation HOWEVER. this would have been easy for any homeowner to put together. We're big fans of WA!!"
2017-03-20,Anthony,US,5,Outstanding,"I've been doing business with Wainscoting America for 5 years now and every project, large or small ends with the same result; a truly professional product!! The W/A team is super to work with right down to the last detail... Every time! 
Anthony Amendola
Advanced Woodworking Systems Inc."
2018-03-30,Sam,US,5,Great Experience,"I worked with Bob, 
My experience has been incredibly, they know what they are doing & do it well, all the way down to the shipping. When the FedEx arrived I just about told the driver to just take it back & don't waste your time unloading, the pallet was broke in half, & it looked like the boxes on the skid were dropped from the truck several times. As I struggled to open the first & top box, I realized the person or persons who designed the packing method should be commended,  as no damage, the brilliance of packing protecting the delicate corners and arranging panels in such a manner that they would survive the harshes of shipping. Thank you Sam"
2018-09-27,Alan Klaich,US,5,Excellent product and service!!,The website is user friendly.  Debbie checked my order and helped me improve my selection.  The material received was perfect quality.  The dimensions were perfect.  I did need to adjust my delivery through a third party.  I would highly recommend this company!!!
2021-03-18,Kathy DeGeorge,US,5,The product and service was great,"The product and service was great 
I have told everyone how wonderful everything is"
2021-08-31,Bill Gaynor,US,5,Spot on perfection,Spot on perfection
2020-11-04,Matthew Schiller,US,5,Love the way they turned out,Love the way they turned out. Easy install
2018-02-06,Irv P.,US,5,Great to do business with,Great to do business with. Thanks for your help.
2017-05-30,Victor DeLusso,US,5,First time customer and a contractor …,First time customer and a contractor for 30 years I can only say...EXCELLENENT experience from start to finish. Debbie is professional knowledgeable and always goes the extra mile.. We will be ordering again for sure.
